{
  "folder_id": "1wGq53okV7ZaFGSw2fWilEfxL4FEIVeIF",
  "folder_url": "https://drive.google.com/drive/folders/1wGq53okV7ZaFGSw2fWilEfxL4FEIVeIF",
  "notebook_id": "6a37d992-6ceb-4d72-a909-e10e9cca32b6",
  "files": {
    "README.md": {
      "drive_file_id": "1IPM7NtGMqOxrpvCwJ9uOtF0h3jjoAayWfP57rgq6cgc",
      "drive_file_name": "fleet-orchestrator_README.md",
      "description": "Fleet Orchestrator \u2014 Headless Autonomous Copilot Fleet Engine",
      "sha256": "94d59376dc876eaa"
    },
    "HANDOFF_FLEET_ORCHESTRATOR.md": {
      "drive_file_id": "17-KjT6qlQkYjBWPkMC1BtgFUNPFzFvuvnA-sZ3v0BdM",
      "drive_file_name": "fleet-orchestrator_HANDOFF.md",
      "description": "Fleet Orchestrator \u2014 Architecture & Operational Handoff",
      "sha256": "847aeba4bfd85f06"
    },
    "team-context.md": {
      "drive_file_id": "1IHRflyaIlGBD2Z3lmMCygzPGwZ8ef9XOFEbmfC1NycU",
      "drive_file_name": "fleet-orchestrator_team-context.md",
      "description": "Fleet Orchestrator \u2014 Team Context & Shared Conventions",
      "sha256": "e48f10f04572b361"
    },
    "team-memory.md": {
      "drive_file_id": "1GwCvv6X_y0VFfRhxuvBU0mICtlOG62OegvVC9c9q_zs",
      "drive_file_name": "fleet-orchestrator_team-memory.md",
      "description": "Fleet Orchestrator \u2014 Team Memory & Accumulated Knowledge Log",
      "sha256": "2ecf40a29f94495e"
    },
    "models/qwen_intent_router_q4_k_m.gguf": {
      "drive_file_id": "1bjXQ4K6hTtOevmG6XFih-AVGP0UlXGEK",
      "drive_file_name": "qwen_intent_router_q4_k_m.gguf",
      "description": "Fine-Tuned Qwen2.5-0.5B-Instruct Intent, Skill & Task Time Allocation Router (Q4_K_M GGUF)",
      "sha256": "4268123a517491c3"
    },
    "models/fleet_master_brain_3b_q4km.gguf": {
      "drive_file_id": "1kZ7hIAeVM6T0AVDwU1bruWRtIaNMLTzR",
      "drive_file_name": "fleet_master_brain_3b_q4km.gguf",
      "description": "Fine-Tuned Qwen2.5-Coder-3B-Instruct Fleet Master Brain Daily Driver (Q4_K_M GGUF, 1.8 GB)",
      "sha256": "02b48d4b11facea0"
    },
    "models/fleet_master_brain_7b_q4km.gguf": {
      "drive_file_id": "1XnqLXF6F7-ibDrJdcZzw-XGRneVQ02Rd",
      "drive_file_name": "fleet_master_brain_7b_q4km.gguf",
      "description": "Fine-Tuned Qwen2.5-Coder-7B-Instruct Fleet Master Brain Powerhouse (Q4_K_M GGUF, 4.36 GB)",
      "sha256": "6152544a9e7cbcea"
    },
    "notebooks/fleet_master_brain_forge.ipynb": {
      "drive_file_id": "1VdTGqTDY32NM_yDchErn01c5fnvFA_uv",
      "drive_file_name": "fleet_master_brain_forge.ipynb",
      "description": "Colab Fine-Tuning Notebook for Fleet Master Brain v2 (Qwen2.5-Coder-3B-Instruct) Forge (A100 SXM4)",
      "colab_url": "https://colab.research.google.com/drive/1VdTGqTDY32NM_yDchErn01c5fnvFA_uv",
      "sha256": "a50d5a7f0ca48a2f"
    },
    "dataset/unified_fleet_train.jsonl": {
      "drive_file_id": "1Q3O5pUmJ5A4pZ2Gg5DUMoVHQEz2v-YWA",
      "drive_file_name": "unified_fleet_train.jsonl",
      "description": "Unified Multi-Task Training Dataset (8,158 samples across Time, Error-Recovery, DAG Sequences, Fellowship & IDE Transcripts)",
      "sha256": "604608dd4c3f94ca"
    },
    "dataset/unified_fleet_eval.jsonl": {
      "drive_file_id": "1EzcECUxPHsCMZ4jkTFT6gwQ75YHq5ztU",
      "drive_file_name": "unified_fleet_eval.jsonl",
      "description": "Unified Multi-Task Evaluation Dataset (2,038 samples across Time, Error-Recovery, DAG Sequences, Fellowship & IDE Transcripts)",
      "sha256": "f895563de49a6985"
    }
  }
}